id,text,category
191,"You don’t have to be great to start, but you have to start to be great. – Zig Ziglar",Productivity
192,"Lost time is never found again. – Benjamin Franklin",Productivity
193,"Start by doing what’s necessary; then do what’s possible, and suddenly you are doing the impossible.",Productivity
194,"A great relationship is about two things: First, appreciating the similarities, and second, respecting the differences.","Love & Relationships"
195,"The most important thing in a relationship is not what you get but what you give.","Love & Relationships"
196,"True love is not about perfection; it’s about growth. It’s about helping each other become the best versions of yourselves.","Love & Relationships"
197,"The meeting of two personalities is like the contact of two chemical substances: if there is any reaction, both are transformed.","Love & Relationships"
198,"In the end, the love you take is equal to the love you make.","Love & Relationships"
199,"A successful relationship requires falling in love multiple times, but always with the same person.","Love & Relationships"
200,"In relationships, the little things are the big things.","Love & Relationships"
201,"A strong relationship requires choosing to love each other, even in those moments when you struggle to like each other.","Love & Relationships"
202,"Relationships don’t last because of the good times; they last because the hard times were handled with love and care.","Love & Relationships"
203,"Love is not about possession. Love is about appreciation.","Love & Relationships"
204,"It’s not your salary that makes you rich, it’s your spending habits.",Finance
205,"Financial peace isn’t the acquisition of stuff. It’s learning to live on less than you make, so you can give money back and have money to invest. You can’t win until you do this.",Finance
206,"Beware of little expenses; a small leak will sink a great ship. – Benjamin Franklin",Finance
207,"Never spend your money before you have it.",Finance
208,"Wealth consists not in having great possessions, but in having few wants. – Epictetus",Finance
209,"Rich people stay rich by living like they’re broke. Broke people stay broke by living like they’re rich.",Finance
210,"You must gain control over your money or the lack of it will forever control you.",Finance
211,"The habit of saving is itself an education; it fosters every virtue, teaches self-denial, cultivates the sense of order, trains forethought, and so broadens the mind.",Finance
212,"A penny saved is a penny earned.",Finance
213,"You don’t need a title to be a leader.",Leadership
214,"People may hear your words, but they feel your attitude.",Leadership
215,"The function of leadership is to produce more leaders, not more followers.",Leadership
216,"Before you are a leader, success is all about growing yourself. When you become a leader, success is all about growing others.",Leadership
217,"The challenge of leadership is to be strong, but not rude; be kind, but not weak; be bold, but not a bully; be thoughtful, but not lazy; be humble, but not timid; be proud, but not arrogant; have humor, but without folly. – Jim Rohn",Leadership
218,"If your actions inspire others to dream more, learn more, do more, and become more, you are a leader.",Leadership
219,"Leadership is practiced not so much in words as in attitude and in actions.",Leadership
220,"The art of leadership is saying no, not yes. It is very easy to say yes. – Tony Blair",Leadership
221,"A leader takes people where they want to go. A great leader takes people where they don’t necessarily want to go, but ought to be.",Leadership
222,"Leadership is not about titles, positions, or flowcharts. It is about one life influencing another.",Leadership
223,"Fulfillment doesn’t come from what we get, it comes from what we give.","Happiness & Fulfilment"
224,"Happiness is not something ready-made. It comes from your own actions.","Happiness & Fulfilment"
225,"Stop chasing happiness; it’s always present in the moments you live, in the small acts of kindness, in the beauty around you.","Happiness & Fulfilment"
226,"Success is getting what you want; happiness is wanting what you get.","Happiness & Fulfilment"
227,"Happiness is not in the mere possession of money; it lies in the joy of achievement, in the thrill of creative effort. – Franklin D. Roosevelt","Happiness & Fulfilment"
228,"Happiness is not a goal; it’s a by-product of a life well-lived. – Eleanor Roosevelt","Happiness & Fulfilment"
229,"Happiness comes when your work and words are of benefit to yourself and others. – Buddha","Happiness & Fulfilment"
230,"You find fulfillment when you stop comparing yourself to others and start focusing on your own journey.","Happiness & Fulfilment"
231,"Don’t wait for everything to be perfect before you decide to enjoy your life.","Happiness & Fulfilment"
232,"Happiness is not the absence of problems; it’s the ability to deal with them.","Happiness & Fulfilment"
233,"You are your own medicine.","Mental Health"
234,"What progress have I made? I have begun to be a friend to myself.",Wisdom
