id,text,category
1,"The best way to predict the future is to invent it.",Leadership
2,"Life is 10% what happens to us and 90% how we react to it.","Mental Health"
3,"An unexamined life is not worth living.","Happiness & Fulfilment"
4,"Eighty percent of success is showing up.",Resilience
5,"Your time is limited, so don't waste it living someone else's life.","Happiness & Fulfilment"
6,"When you tolerate an error, you rob yourself of learning. When you ruminate on an error, you rob yourself of happiness. Notice it, improve it, and move on from it.",Wisdom
7,"You need to accept as much responsibility as you can tolerate and then build yourself into people who can tolerate even more responsibility. And to accept that gratefully because that’s where the purpose and meaning in life is.",Resilience
8,"You can ignore your weaknesses, but you can't expect them to not impact you. The weakness of the coach shapes the players. The weakness of the teacher influences the students. The weakness of the parent molds the child.",Character
10,"I am always doing what I can't do yet in order to learn how to do it. (Painter Vincent Van Gogh on pushing yourself)",Mastery
11,"In a world where intelligence is hyper-competitive and many previous technical skills have become automated, competitive advantages tilt toward nuanced and soft skills – like communication, empathy, and, perhaps most of all, flexibility.",Career
12,"Savings can be created by spending less. You can spend less if you desire less. And you will desire less if you care less about what others think of you.",Finance
16,"Miss a meal but never miss reading a book.",Character
18,"The limits of my language mean the limits of my world.",Character
19,"You only attract who you are.",Character
20,"The 10,000 hours rule – ‘the neurons that fire together wire together.’ You get better at anything you attentively practice.",Mastery
22,"Savings without a spending goal gives you options and flexibility, the ability to wait and the opportunity to pounce. It gives you time to think. It lets you change course on your own terms.",Finance
23,"Savings can be created by spending less. You can spend less if you desire less. And you will desire less if you care less about what others think of you.",Finance
24,"The most powerful way to increase your savings isn't to raise your income. It’s to raise your humility.",Finance
25,"The bad workouts are the most important ones. It's easy to train when you feel good, but it's crucial to show up when you don't feel like it—even if you do less than you hope. 

Going to the gym for 15 minutes might not improve your performance, but it reaffirms your identity. It's not always about what happens during the workout. It's about becoming the type of person who doesn't miss workouts.",Exercise
26,"In many cases, what you hope to learn by reading books or listening to podcasts can only be learned by attempting what you fear. Some knowledge is only revealed through action.",Character
27,"And once the storm is over, you won't remember how you made it through, how you managed to survive. You won't even be sure whether the storm is really over. But one thing is certain. When you come out of the storm, you won't be the same person who walked in. That's what this storm's all about.",Character
28,"There is no safe investment. To love at all is to be vulnerable. Love anything, and your heart will certainly be wrung and possibly be broken. If you want to make sure of keeping it intact, you must give your heart to no one, not even to an animal. Wrap it carefully round with hobbies and little luxuries; avoid all entanglements; lock it up safe in the casket or coffin of your selfishness. But in that casket—safe, dark, motionless, air-less—it will change. It will not be broken; it will become unbreakable, impenetrable, irredeemable. The alternative to tragedy, or at least to the risk of tragedy, is damnation. The only place outside Heaven where you can be perfectly safe from all the dangers and perturbations of love is Hell.","Love & Relationships"
29,"Someday, in years to come, you will be wrestling with the great temptation, or trembling under the great sorrow of your life. But the real struggle is here, now, in these quiet weeks. Now it is being decided whether, in the day of your supreme sorrow or temptation, you shall miserably fail or gloriously conquer",Resilience
30,"Communication is about what is received, not what is intended. If there is a gap between what you are saying and what they are hearing, you have to find a new way to say it.",Communication
31,"Finding your way in life is like unlocking the combination of a safe. You have to go forwards and backwards. Life is not a direct march from A to B. The twists and turns are progress, not regression. What feels like a setback in the moment is later revealed to have been part of the path all along. Each move was necessary to get to your end goal.",Resilience
32,"If you can bite, you generally don’t have to. When skillfully integrated, the ability to respond with aggression and violence decreases rather than increases the probability that actual aggression will be necessary. There is very little difference between the capacity for mayhem and destruction, integrated, and strength of character. This is one of the most difficult lessons of life.",Character
33,"Mastery requires lots of practice. But the more you practice something, the more boring and routine it becomes. Thus, an essential component of mastery is the ability to maintain your enthusiasm. The master continues to find the fundamentals interesting.",Mastery
34,"Gargantuan results are much less about your inherited genetics and far more about your daily habits. And your morning ritual is by far the most essential one to calibrate. And then automate.",Mastery
35,"Become a bigger person and you’ll also automatically become a better leader – and a great producer.",Leadership
36,"One who sweats more in training, bleeds less in war.",Mastery
37,"Pain is the doorway into deep. Know what I mean? And tragedy is nature’s great purifier. It burns away the fakeness, fear, and arrogance that is of the ego. Return us to our brilliance and genius, if you have the courage to go into that which wounds you. Suffering yields many rewards, including empathy, originality, relatability, and authenticity.",Resilience
38,"Life rewards action, not intelligence. Many brilliant people talk themselves out of getting started, and being smart doesn't help very much without the courage to act. You can't win if you're not in the game.",Productivity
39,"You can't do everything, but you can do one thing and then another and another. In terms of energy, it's better to make a wrong choice than none at all. You might begin by listing your priorities—for the day, for the week, for the month, for a lifetime. Start modestly. List everything you want to do today or tomorrow. Set priorities by dividing the items into A, B, and C categories. At the least, accomplish the A items. Try the same thing with long-term goals. Priorities do shift, and you can change them at any time, but simply getting them down in black and white adds clarity to your life, and clarity creates energy.",Productivity
40,"It is amateurs who have one big bright, beautiful idea that they can never abandon. Professionals know that they have to produce theory after theory before they are likely to hit the jackpot.",Creativity
41,"Don't wait to start writing until you have something to say. Start writing so you can find out what you have to say. 
Your first idea is rarely your best idea. It can take a lot of reps before you discover something worth keeping.",Creativity
42,"No one said that to be happy, you should try to work as hard as you can to make money to buy the things you want. Or it’s important to be at least as wealthy as the people around you, and if you have more than they do, it’s real success. Or you should choose your work based on your desired future earning power. What they did value were things like quality friendships, being part of something bigger than themselves, and spending unstructured time with their children.","Happiness & Fulfilment"
43,"When asked about his silence during meetings, Rockefeller often recited a poem:
A wise old owl lived in an oak, -- 
The more he saw the less he spoke -- 
The less he spoke, the more he heard -- 
Why aren’t we all like that wise old bird?",Charisma
44,"We only hear what we’re ready to hear. All learning meets us exactly where we’re at. And as we grow greater, we understand better.",Character
45,"You become what you pay attention to.",Character
46,"Track your calories; what gets measured, gets improved.",Diet
47,"Don’t cut carbs; they’re essential fuel for performance.",Diet
48,"Stay in a calorie deficit to lose fat; it’s the foundation of fat loss.",Diet
49,"Choose whole foods over processed options for better nutrition.",Diet
50,"Hydrate well—drink water before meals.",Diet
51,"Focus on fiber-rich foods to stay full longer.",Diet
52,"Eat 20%-30% of your calories from healthy fats for hormone balance.",Diet
53,"Reduce unnecessary stress to prevent emotional eating.",Diet
54,"Prioritize protein intake—aim for 1.5g per kg of body weight.",Diet
55,"Use a calorie-tracking app to stay consistent.",Diet
56,"Pair cardio with strength training to boost overall fitness.",Exercise
57,"Warm up properly to avoid injuries.",Exercise
58,"Aim for consistency over perfection in your workouts.",Exercise
59,"Rest and recover to build strength and muscle.",Exercise
60,"Focus on progressive overload—add more reps or weight each week.",Exercise
61,"Keep a record of your sets and reps to track progress.",Exercise
62,"Stretch after workouts to maintain flexibility.",Exercise
63,"Incorporate compound lifts like squats and deadlifts for overall strength.",Exercise
64,"Incorporate cardio for increased calorie burn and heart health.",Exercise
65,"Challenge yourself with new exercises regularly.",Exercise
66,"God, grant me the serenity to accept the things I cannot change, courage to change the things I can, and wisdom to know the difference.",Prayer
67,"Lord, make me an instrument of Your peace. Where there is hatred, let me sow love; where there is injury, pardon; where there is doubt, faith; where there is despair, hope; where there is darkness, light; and where there is sadness, joy.",Prayer
68,"God, to whom we turn for guidance, be with us always. Grant us strength, the spirit of sacrifice, and the will to do what is right. Let us walk on the path of righteousness and find peace.",Prayer
69,"In the name of Allah, the Most Gracious, the Most Merciful. Praise be to Allah, the Lord of all worlds, the Most Gracious, the Most Merciful, Master of the Day of Judgment. You alone we worship, and You alone we ask for help. Guide us on the Straight Path, the path of those who have received Your grace; not the path of those who have brought down wrath upon themselves, nor of those who have gone astray.",Prayer
70,"Our Father, who art in heaven, hallowed be Thy name. Thy kingdom come, Thy will be done, on earth as it is in heaven. Give us this day our daily bread; and forgive us our trespasses, as we forgive those who trespass against us; and lead us not into temptation, but deliver us from evil. Amen.",Prayer
71,"May the entire universe be blessed with peace and hope. May everyone driven by envy and enmity become friendly and loving. May all living beings find relief from pain and suffering. May everyone be healthy, happy, and prosperous. May our minds be filled with thoughts of peace, joy, and compassion for others.",Prayer
72,"O Allah, I seek Your guidance [in making a choice] by virtue of Your knowledge, and I seek ability by virtue of Your power, and I ask You of Your great bounty. You have power, I have none. And You know, I know not. You are the Knower of hidden things. O Allah, if in Your knowledge, this matter be good for me in my religion, my livelihood, and my affairs, then ordain it for me and make it easy for me, and bless it for me.",Prayer
73,"May the Lord protect and bless us. May He nourish us, giving us strength to work together for the good of humanity. May our learning be brilliant and purposeful. May we never turn against one another. Om, peace, peace, peace.",Prayer
74,"In beauty I walk. With beauty before me I walk. With beauty behind me, I walk. With beauty above me, I walk. With beauty around me, I walk. It has become beauty again. Today I will walk out; today everything negative will leave me. I will be as I was before. I will have a cool breeze over my body. I will have a light body. I will be happy forever. Nothing will hinder me. I walk with beauty before me. I walk with beauty behind me. I walk with beauty above me. I walk with beauty around me. My words will be beautiful.",Prayer
75,"May I be a guard for those who need protection, a guide for those on the path, a boat, a raft, a bridge for those who wish to cross the flood. May I be a lamp in the darkness, a resting place for the weary, a healing medicine for all who are sick, a vase of plenty, a tree of miracles. And for the boundless multitudes of living beings, may I bring sustenance and awakening, enduring like the earth and sky until all beings are freed from sorrow and all are awakened.",Prayer
76,"When you arise in the morning, think of what a precious privilege it is to be alive – to breathe, to think, to enjoy, to love.",Gratitude
77,"Acknowledging the good that you already have in your life is the foundation for all abundance.",Gratitude
78,"Enjoy the little things, for one day you may look back and realize they were the big things.",Gratitude
79,"Gratitude unlocks the fullness of life. It turns what we have into enough, and more. It turns denial into acceptance, chaos into order, confusion into clarity... It makes sense of our past, brings peace for today, and creates a vision for tomorrow.",Gratitude
80,"Wear gratitude like a cloak, and it will feed every corner of your life.",Gratitude
81,"Express your gratitude by giving back. Let your actions reflect the blessings you have received.",Gratitude
82,"Gratitude is a verb. Show it in the way you treat others, the way you face challenges, and the way you celebrate life.",Gratitude
83,"Feeling gratitude and not expressing it is like wrapping a present and not giving it. Share your appreciation through your actions.",Gratitude
84,"Gratitude is the most exquisite form of courtesy. Practice it daily by making someone’s day brighter.",Gratitude
85,"Gratitude is a magnet for miracles. Attract more into your life by actively showing your appreciation every day.",Gratitude
86,"Turn your gratitude into generosity. Let your thankfulness inspire you to give more, love more, and live more fully.",Gratitude
87,"Gratitude is a practice, not a feeling. Make a habit of showing thanks in everything you do.",Gratitude
88,"Anything that’s human is mentionable, and anything that is mentionable can be more manageable. When we can talk about our feelings, they become less overwhelming, less upsetting, and less scary.","Mental Health"
89,"You are not your illness. You have an individual story to tell. You have a name, a history, a personality. Staying yourself is part of the battle.","Mental Health"
90,"Mental health is not a destination but a process. It’s about how you drive, not where you’re going.","Mental Health"
91,"You don’t have to control your thoughts. You just have to stop letting them control you.","Mental Health"
92,"You are not a burden. You have a story to tell, and there’s a person who needs to hear it.","Mental Health"
93,"The greatest weapon against stress is our ability to choose one thought over another.","Mental Health"
94,"You, yourself, as much as anybody in the entire universe, deserve your love and affection – Buddha.","Mental Health"
95,"Feelings are just visitors. Let them come and go.","Mental Health"
96,"There is hope, even when your brain tells you there isn’t.","Mental Health"
97,"Sometimes the people around you won’t understand your journey. They don’t need to; it’s not for them.","Mental Health"
98,"The future depends on what you do today. – Mahatma Gandhi",Career
99,"Success usually comes to those who are too busy to be looking for it.",Career
100,"The only way to do great work is to love what you do. If you haven’t found it yet, keep looking. Don’t settle. – Steve Jobs",Career
101,"Dream big. Start small. Act now. – Robin Sharma",Career
102,"Do not be embarrassed by your failures, learn from them and start again.",Career
103,"A year from now, you may wish you had started today.",Wisdom
104,"You miss 100% of the shots you don’t take.",Wisdom
105,"The secret of getting ahead is getting started.",Wisdom
106,"Your work is going to fill a large part of your life, and the only way to be truly satisfied is to do what you believe is great work.",Career
107,"Find out what you like doing best, and get someone to pay you for doing it.",Career
108,"It’s not what you achieve, it’s what you overcome. That’s what defines your career.",Career
109,"Your career is like a garden. It can hold an assortment of life’s energy: creativity, productivity, sustenance, aesthetics, and endless growth.",Career
110,"Don’t watch the clock; do what it does. Keep going.",Career
111,"Charisma is not just saying hello. It’s dropping what you’re doing to say hello.",Charisma
112,"People will forget what you said, people will forget what you did, but people will never forget how you made them feel.",Charisma
113,"Charisma isn’t about being the best talker in the room; it’s about being the best listener.",Charisma
114,"Charisma is not about getting people to like you. It’s about inspiring them to like themselves when they’re around you.",Charisma
115,"To be charismatic, be more interested than interesting.",Charisma
116,"The most magnetic leaders aren’t necessarily the loudest, but the ones who are authentically themselves.",Charisma
117,"Charisma is the ability to project confidence and love at the same time.",Charisma
118,"Charisma begins when you let go of the need to impress and start focusing on how you can add value.",Charisma
119,"The most charming people listen as if what you have to say is the most important thing in the world.",Charisma
120,"Charisma isn’t about always being the center of attention; it’s about making others feel like they are.",Charisma
121,"Charisma is not just a gift; it’s a skill that you cultivate by caring about others more than yourself.",Charisma
122,"Charisma is the result of effective communication, not the other way around.",Charisma
123,"Don’t wait for inspiration. It comes while working.",Creativity
124,"Creativity doesn’t wait for that perfect moment. It fashions its own perfect moments out of ordinary ones.",Creativity
125,"The desire to create is one of the deepest yearnings of the human soul.",Creativity
126,"Start where you are. Use what you have. Do what you can.",Creativity
127,"To live a creative life, we must lose our fear of being wrong.",Creativity
128,"The chief enemy of creativity is ‘good’ sense. – Pablo Picasso",Creativity
129,"Creativity takes courage.",Creativity
130,"Have no fear of perfection; you’ll never reach it.",Creativity
131,"Great things are not done by impulse, but by a series of small things brought together. – Vincent Van Gogh",Creativity
132,"The true sign of intelligence is not knowledge but imagination.  – Albert Einstein",Creativity
133,"It’s not about what you know, but about who you know—and who knows you.",Networking
134,"Your network is your net worth.",Networking
135,"The richest people in the world look for and build networks; everyone else looks for work.",Networking
136,"Networking is not about just connecting people. It’s about connecting people with people, people with ideas, and people with opportunities.",Networking
137,"The currency of real networking is not greed but generosity.",Networking
138,"Don’t ask what your network can do for you. Ask what you can do for your network.",Networking
139,"You can have everything in life you want if you will just help enough other people get what they want.",Networking
140,"Your success is directly proportional to the number of people you positively impact.",Networking
141,"In networking, sincerity is not a strategy; it’s the foundation.",Networking
142,"If you want to go fast, go alone. If you want to go far, go with others.",Networking
143,"The single greatest ‘people skill’ is a highly developed and authentic interest in the other person.",Networking
144,"Your smile is your logo, your personality is your business card, and how you leave others feeling after an experience with you becomes your trademark.",Networking
145,"Networking is a lot like nutrition and fitness: we know what to do, the hard part is making it a top priority.",Networking
146,"The most important thing in communication is hearing what isn’t said.",Communication
147,"Speak in such a way that others love to listen to you. Listen in such a way that others love to speak to you.",Communication
148,"Communication works for those who work at it. – John Powell",Communication
149,"The art of communication is the language of leadership. – James Humes",Communication
150,"Words are, of course, the most powerful drug used by mankind.",Communication
151,"To effectively communicate, we must realize that we are all different in the way we perceive the world and use this understanding as a guide to our communication with others.",Communication
152,"Communication is not about proving your point; it’s about creating a shared understanding.",Communication
153,"Wise men speak because they have something to say; fools because they have to say something. – Plato",Communication
154,"Effective communication is 20% what you know and 80% how you feel about what you know. – Jim Rohn",Communication
155,"The way we communicate with others and with ourselves ultimately determines the quality of our lives.",Communication
156,"You can change your world by changing your words. Remember, death and life are in the power of the tongue.",Communication
157,"Speak clearly, if you speak at all; carve every word before you let it fall.",Communication
158,"The most effective way to communicate is to listen.",Communication
159,"Communication is your ticket to success, if you pay attention and learn to do it effectively.",Communication
160,"Kind words can be short and easy to speak, but their echoes are truly endless. – Mother Teresa",Communication
161,"Take every opportunity to practice your communication skills so that when important occasions arise, you will have the gift, the style, the sharpness, the clarity, and the emotions to affect other people. – Jim Rohn",Communication
162,"Good communication is the bridge between confusion and clarity.",Communication
163,"The ability to simplify means to eliminate the unnecessary so that the necessary may speak.",Communication
164,"Wisdom is the reward you get for a lifetime of listening when you’d have preferred to talk.",Wisdom
165,"We learn wisdom from failure much more than from success. We often discover what will do, by finding out what will not do.",Career
166,"To acquire knowledge, one must study; but to acquire wisdom, one must observe.",Wisdom
167,"Knowing yourself is the beginning of all wisdom. – Aristotle",Wisdom
168,"Do not seek to follow in the footsteps of the wise; seek what they sought.",Wisdom
169,"The invariable mark of wisdom is to see the miraculous in the common.",Wisdom
170,"Knowledge speaks, but wisdom listens.",Wisdom
171,"A smart person knows what to say. A wise person knows whether or not to say it.",Wisdom
172,"The simple things are also the most extraordinary things, and only the wise can see them. – Paulo Coelho",Wisdom
173,"In seeking wisdom, the first step is silence, the second is listening, the third is remembering, the fourth is practicing, and the fifth is teaching others.",Wisdom
174,"Wisdom is knowing the right path to take. Integrity is taking it.",Wisdom
175,"To understand the heart and mind of a person, look not at what he has achieved, but at what he aspires to.",Wisdom
176,"The journey of a thousand miles begins with one step, but wisdom starts with a single thought.",Wisdom
177,"The wise man doesn’t give the right answers, he poses the right questions.",Wisdom
178,"The simple things are also the most extraordinary things, and only the wise can see them.",Wisdom
179,"Trust your intuition. - Amal AlRoumi","Human Gifts"
180,"Go all the way. Never give up! - Jaime Zelada (USC Viterbi graduate advisor) said to me on my master's graduation day.","Human Gifts"
181,"The way to get started is to quit talking and begin doing.",Productivity
182,"Focus on being productive instead of busy.",Productivity
183,"It’s not always that we need to do more, but rather that we need to focus on less.",Productivity
184,"The key is not to prioritize what’s on your schedule, but to schedule your priorities.",Productivity
185,"Small daily improvements over time lead to stunning results. – Robin Sharma",Productivity
186,"Amateurs sit and wait for inspiration, the rest of us just get up and go to work.",Productivity
187,"The true price of anything you do is the amount of time you exchange for it.",Productivity
188,"You don’t need more time; you just need to decide.",Productivity
189,"Simplicity boils down to two steps: Identify the essential. Eliminate the rest.",Productivity
190,"Action is the foundational key to all success. – Pablo Picasso",Productivity
